Name,Type,Personality,Energy-Level,Good-With-Children,Good-With-Other-Dogs,Shedding, Grooming,Tranability,Height,Weight,Life-Expectancy,Barking-Level,Summary-Energy,Summary-Size
Welsh Springer Spaniel,Sporting Group,"Happy, upbeat, family oriented; reserved but not shy with strangers","Very Active; Curious and highly energetic, Welshies need regular exercise to stave off problem behaviors",Yes,With Supervision,Seasonal,Occasional,Eager To Please,"18-19 inches (male), 17-18 inches (female)","40-55 pounds (male), 35-50 pounds (female)",12-15 years,Barks When Necessary,medium energy,medium size
Welsh Terrier,Terrier Group,"As alert and spirited as any self-respecting terrier, but a bit calmer than most","Somewhat Active; Upbeat but not hyper, Welsh exercise needs are moderate",Yes,With Supervision,Seasonal,Weekly,Eager To Please,"15 inches (male), porportionally smaller (female)","20 pounds, porportionally smaller (female)",12-15 years,Barks When Necessary,medium energy,small size
West Highland White Terrier,Terrier Group,"Happy, smart, loyal, entertaining","Very Active; true terriers, Westies are quick, curious, and lively",Yes,With Supervision,Seasonal,Weekly,Responds Well,"11 inches (male). 10 inches, female",15-20 pounds,13-15 years,Barks When Necessary,medium energy,small size
Whippet,Hound Group,"Calm, affectionate, and playful",Somewhat Active; This breed has spurts of energetic moments followed by a lazy afternoon,Better with Supervision,Yes,Seasonal,Occasional,Responds Well,"19-22 inches (male), 18-21 inches (female)",25-40 pounds,12-15 years,Quiet,medium energy,medium size
Wirehaired Vizsla,Sporting Group,Calm and gentle around the house; an exuberant hunter on land or lake,"Very Active; An energetic worker built for long days in the field; they enjoy hunting, swimming, and upbeat play",Better with Supervision,With Supervision,Seasonal,Occasional,Responds Well,"22.75-25.25 inches (male), 21.25-23.5 inches (female)","55-65 pounds (male), 45-55 pounds (female)",12-14 years,Barks When Necessary,medium energy,medium size
Working Kelpie,Herding Group,Calm and gentle around the house; an exuberant hunter on land or lake,"Very Active; An energetic worker built for long days in the field; they enjoy hunting, swimming, and upbeat play",Better with Supervision,With Supervision,Seasonal,Occasional,Responds Well,"22.75-25.25 inches (male), 21.25-23.5 inches (female)","55-65 pounds (male), 45-55 pounds (female)",12-14 years,Barks When Necessary,high energy,medium size
Xoloitzcuintli,Non Sporting Group,"Loyal, alert, calm, trainable; like any good watchdog, they're wary of strangers",Somewhat Active; Xolos like long walks and upbeat play but are famously tranquil around the house,Better with Supervision,With Supervision,"Infrequent, Hypoallergenic",Occasional,Responds Well,"10-14 inches (toy), 14-18 inches (miniature), 18-23 inches (standard)","10-15 pounds (toy), 15-30 pounds (miniature), 30-55 pounds (standard)",13-18 years,Barks When Necessary,medium energy,medium size
Yakutian Laika,Working Group,"Loyal, alert, calm, trainable; like any good watchdog, they're wary of strangers",Somewhat Active; Xolos like long walks and upbeat play but are famously tranquil around the house,Better with Supervision,With Supervision,"Infrequent, Hypoallergenic",Occasional,Responds Well,"10-14 inches (toy), 14-18 inches (miniature), 18-23 inches (standard)","10-15 pounds (toy), 15-30 pounds (miniature), 30-55 pounds (standard)",13-18 years,Barks When Necessary,medium energy,large size
Yorkshire Terrier,Toy Group,"Sprightly, tomboyish, and affectionate",Somewhat Active; Yorkies are moderately active and will be happy with a daily satisfying walk,Better with Supervision,With Supervision,Infrequent,Daily,Independent,7-8 inches,7 pounds,11-15 years,Barks When Necessary,medium energy,small size
