Name,Type,Personality,Energy-Level,Good-With-Children,Good-With-Other-Dogs,Shedding, Grooming,Tranability,Height,Weight,Life-Expectancy,Barking-Level,Summary-Energy,Summary-Size
Affenpinscher,Toy Group,"Loyal, curious, famously funny; fearless out of all proportion to their size","Somewhat Active; Brisk walks, making new friends, and plenty of play will satisfy exercise needs",Better with Supervision,With Supervision,Seasonal,Weekly,Eager To Please,9-11.5 inches,7-10 pounds,12-15 years,Barks When Necessary,medium energy,small size
Afghan Hound,Hound Group,A breed of charming contradictions,"Very Active; Bred for high-speed pursuit, Afghans need fenced-in running room and brisk walks",Better with Supervision,With Supervision,"Infrequent, Hypoallergenic",Weekly,Independent,25-27 inches,50-60 pounds,12-18 years,Barks When Necessary,high energy,large size
Airedale Terrier,Terrier Group,"Clever, confident, proud; friendly but courageous","Very Active; A spirited do-it-all breed, Airedales thrive on physical challenges and mental stimulation",Better with Supervision,With Supervision,Seasonal,Weekly,Eager To Please,23 inches,50-70 pounds,11-14 years,Barks When Necessary,medium energy,medium size
Akita,Working Group,"Dignified, courageous, and profoundly loyal to their humans","Somewhat Active; Not a hyper breed, but these big guys enjoy regular exercise",Better with Supervision,Not Recommended,Seasonal,Weekly,Eager To Please,"26-28 inches (male), 24-26 inches (female)","100-130 pounds (male), 70-100 pounds (female)",10-13 years,Quiet,medium energy,large size
Alaskan Malamute,Working Group,"Affectionate, loyal, playful but dignified","Somewhat Active; A very strong dog built for heavy work, the big guy craves regular exercise",Better with Supervision,With Supervision,Seasonal,Weekly,Independent,"25 inches (male), 23 inches (female)","85 pounds (male), 75 pounds (female)",10-14 years,Barks When Necessary,high energy,large size
American English Coonhound,Hound Group,Sweet and mellow; sociable with dogs and people alike,"Very Active; One whiff of raccoon, and this mild-mannered gentleman becomes Superhound",Better with Supervision,Yes,Seasonal,Occasional,Responds Well,"24-26 inches (male), 23-25 inches (female)",45-65 pounds,11-12 years,Likes To Be Vocal,high energy,large size
American Eskimo Dog,Non Sporting Group,"Playful, perky, very smart; an excellent trick dog and watchdog","Very Active; This quick, curious dog needs regular exercise and mental challenges",Yes,With Supervision,Seasonal,Occasional,Eager To Please,"9-12 inches (toy), 12-15 inches (miniature), 15-19 inches (Standard)","6-10 pounds (toy), 10-20 pounds (miniature), 25-35 pounds (standard)",13-15 years,Barks When Necessary,medium energy,medium size
American Foxhound,Hound Group,"Sweet-tempered and easygoing, but also stubborn and independent","Very Active; They could be called “Springsteen hounds” because, baby, they were born to run; lots of exercise required",Yes,Yes,Seasonal,Occasional,Responds Well,"22-25 inches (male), 21-24 inches (female)","65-70 pounds (male), 60-65 pounds (female)",11-13 years,Barks When Necessary,high energy,large size
American Hairless Terrier,Terrier Group,"Feisty, inquisitive, playful; a real terrier","Somewhat Active; not a hyper dog, but upbeat and game for anything Coat and Grooming",Yes,With Supervision,"Infrequent, Hypoallergenic",Occasional,Eager To Please,12-16 inches,12-16 pounds,14-16 years,Barks When Necessary,medium energy,small size
American Leopard Hound,Hound Group,"Feisty, inquisitive, playful; a real terrier","Somewhat Active; not a hyper dog, but upbeat and game for anything Coat and Grooming",Yes,With Supervision,"Infrequent, Hypoallergenic",Occasional,Eager To Please,12-16 inches,12-16 pounds,14-16 years,Barks When Necessary,low energy,large size
American Staffordshire Terrier,Terrier Group,"Feisty, inquisitive, playful; a real terrier","Somewhat Active; not a hyper dog, but upbeat and game for anything Coat and Grooming",Yes,With Supervision,"Infrequent, Hypoallergenic",Occasional,Eager To Please,12-16 inches,12-16 pounds,14-16 years,Barks When Necessary,medium energy,medium size
American Water Spaniel,Sporting Group,"Happy, eager, and charming; aloof with strangers, and a little stubborn",Very Active; Upbeat AWS are outdoorsy athletes who love hunting and swimming,Better with Supervision,With Supervision,Infrequent,Weekly,Eager To Please,15-18 inches,"30-45 pounds (male), 25-40 pounds (female)",10-14 years,Barks When Necessary,medium energy,medium size
Anatolian Shepherd Dog,Working Group,"Calm, watchful, loyal, and smart; protective and territorial","Somewhat Active; These big guys live for long walks, romps in the yard, and something or someone to guard",Better with Supervision,With Supervision,Seasonal,Occasional,Independent,"29 inches (male), 27 inches (female)","110-150 pounds (male), 80-120 pounds (female)",11-13 years,Barks When Necessary,medium energy,large size
Australian Cattle Dog,Herding Group,"Alert, curious, and pleasant",Very Active; These high-energy dogs need a job to remain happy,Better with Older Children,With Supervision,Seasonal,Occasional,Independent,"18-20 inches (male), 17-19 inches (female)",35-50 pounds,12-16 years,Barks When Necessary,high energy,medium size
Australian Kelpie,Herding Group,"Alert, curious, and pleasant",Very Active; These high-energy dogs need a job to remain happy,Better with Older Children,With Supervision,Seasonal,Occasional,Independent,"18-20 inches (male), 17-19 inches (female)",35-50 pounds,12-16 years,Barks When Necessary,high energy,medium size
Australian Shepherd,Herding Group,"Smart, work-oriented, exuberant","Very Active; True working dogs, unemployment doesn't agree with these guys.",Yes,With Supervision,Seasonal,Occasional,Independent,"20-23 inches (male), 18-21 inches (female)","55-70 pounds (male), 35-55 pounds (female)",13-15 years,Barks When Necessary,high energy,medium size
Australian Terrier,Terrier Group,"Plucky, spirited, and smart; how do they fit so much dog into such a bitty package?","Very Active; Upbeat and lively, with lots of old-time terrier curiosity and grit",Yes,With Supervision,Infrequent,Occasional,Responds Well,10-11 inches,12-18 pounds,11-15 years,Barks When Necessary,high energy,small size
Azawakh,Miscellaneous,"Plucky, spirited, and smart; how do they fit so much dog into such a bitty package?","Very Active; Upbeat and lively, with lots of old-time terrier curiosity and grit",Yes,With Supervision,Infrequent,Occasional,Responds Well,10-11 inches,12-18 pounds,11-15 years,Barks When Necessary,high energy,large size
Barbet,Sporting Group,"Plucky, spirited, and smart; how do they fit so much dog into such a bitty package?","Very Active; Upbeat and lively, with lots of old-time terrier curiosity and grit",Yes,With Supervision,Infrequent,Occasional,Responds Well,10-11 inches,12-18 pounds,11-15 years,Barks When Necessary,low energy,medium size
Basenji,Hound Group,"Smart, independent, alert, and poised; affectionate with friends, aloof with strangers","Very Active; Energetic, inquisitive hounds, Basenjis need running room and lots of exercise",Better with Older Children,With Supervision,Seasonal,Occasional,Independent,"17 inches (male), 16 inches (female)","24 pounds (male), 22 pounds (female)",13-14 years,Quiet,high energy,medium size
Basset Hound,Hound Group,Patient and low-key; a bit stubborn but always charming,Not Very Active; Bassets are not the most active breed but do need regular walks to stay healthy,Yes,Yes,Seasonal,Weekly,Responds Well,up to 15 inches,40-65 pounds,12-13 years,Barks When Necessary,medium energy,medium size
Bavarian Mountain Scent Hound,Hound Group,Patient and low-key; a bit stubborn but always charming,Not Very Active; Bassets are not the most active breed but do need regular walks to stay healthy,Yes,Yes,Seasonal,Weekly,Responds Well,up to 15 inches,40-65 pounds,12-13 years,Barks When Necessary,low energy,medium size
Beagle,Hound Group,"Merry, friendly, and curious","Very Active; This quick, energetic and compact hound dog needs plenty of exercise",Yes,Yes,Seasonal,Weekly,Responds Well,"13 inches & under, 13-15 inches","under 20 pounds (13 inches & under), 20-30 pounds (13-15 inches)",10-15 years,Likes To Be Vocal,medium energy,small size
Bearded Collie,Herding Group,"Bouncy, charismatic, friendly; smart, but also stubborn and independent","Very Active; Beardies are energetic, boisterous dogs who love outdoor exercise in all weather",Yes,Yes,Seasonal,Weekly,Independent,"21-22 inches (male), 20-21 inches (female)",45-55 pounds,12-14 years,Likes To Be Vocal,medium energy,medium size
Beauceron,Herding Group,"Smart, obedient, gentle; reserved with strangers, loving and eager to please with preferred humans","Very Active; Powerful, athletic, and very clever, Beaucerons needs lot of physical and mental challenges",Better with Supervision,With Supervision,Frequent,Weekly,Responds Well,"25.5-27.5 inches (male), 24-26.5 inches (female)",70-110 pounds,10-12 years,Barks When Necessary,high energy,large size
Bedlington Terrier,Terrier Group,"Rollicking, charming, and full of fun; a loyal member of the family",Very Active; Bedlingtons combine terrier energy with the sprinting ability of small coursing hounds,Better with Supervision,With Supervision,"Infrequent, Hypoallergenic",Weekly,Responds Well,"16.0-17.5 inches (male), 15-16.5 inches (female)",17-23 pounds,11-16 years,Barks When Necessary,medium energy,medium size
Belgian Laekenois,Miscellaneous,"Rollicking, charming, and full of fun; a loyal member of the family",Very Active; Bedlingtons combine terrier energy with the sprinting ability of small coursing hounds,Better with Supervision,With Supervision,"Infrequent, Hypoallergenic",Weekly,Responds Well,"16.0-17.5 inches (male), 15-16.5 inches (female)",17-23 pounds,11-16 years,Barks When Necessary,high energy,large size
Belgian Malinois,Herding Group,"Smart, confident, hardworking, and steadfastly loyal",Very Active; A high-energy worker who demands plenty of exercise,Better with Supervision,With Supervision,Seasonal,Occasional,Eager To Please,"24-26 inches (male), 22-24 inches (female)","60-80 pounds (male), 40-60 pounds (female)",14-16 years,Barks When Necessary,high energy,large size
Belgian Sheepdog,Herding Group,"Serious-minded, watchful, and very bright and trainable","Very Active; A breed built for hard work, and plenty of it",Better with Supervision,With Supervision,Seasonal,Weekly,Eager To Please,"24-26 inches (male), 22-24 inches (female)","55-75 pounds (male), 45-60 pounds (female)",12-14 years,Barks When Necessary,high energy,medium size
Belgian Tervuren,Herding Group,"Smart, self-assured, very trainable; affectionate and possessive with loved ones",Very Active; Lots of hard work and challenging play is a Terv’s idea of heaven,Better with Supervision,With Supervision,Seasonal,Weekly,Eager To Please,"24-26 inches (male), 22-24 inches (female)","55-75 pounds (male), 45-60 pounds (female)",12-14 years,Barks When Necessary,high energy,medium size
Bernese Mountain Dog,Working Group,Good-natured and calm.,"They love outdoor activities, like hiking or even pulling young children in a cart.",Yes,Yes,Lots Of Shedding,Weekly,Eager To Please,"25-28 inches (male), 23-26 inches (female)","86-110 pounds (male), 79-110 pounds (female)",6-8 years,Barks When Necessary,medium energy,large size
Bichon Frise,Non Sporting Group,"Playful, curious, and peppy","Somewhat Active; Short bursts of energy are balanced with cuddly, loveable periods",Yes,Yes,"Infrequent, Hypoallergenic",Daily,Responds Well,9.5-11.5 inches,12-18 pounds,14-15 years,Barks When Necessary,medium energy,small size
Biewer Terrier,Not found!,"Playful, curious, and peppy","Somewhat Active; Short bursts of energy are balanced with cuddly, loveable periods",Yes,Yes,"Infrequent, Hypoallergenic",Daily,Responds Well,9.5-11.5 inches,12-18 pounds,14-15 years,Barks When Necessary,low energy,small size
Black and Tan Coonhound,Hound Group,"Easygoing, friendly, bright; mellow by the fireside, rugged and brave on the trail","Somewhat Active; Big, athletic hunters who work nights, B&Ts need regular exercise between naps",Yes,Yes,Seasonal,Occasional,Independent,"25-27 inches (male), 23-25 inches (female)",65-110 pounds,10-12 years,Likes To Be Vocal,medium energy,medium size
Black Russian Terrier,Working Group,"Smart, confident, courageous, sometimes stubborn; protective of loved ones, aloof with strangers","Somewhat Active; A calm housemate, but boisterous and athletic at play; a great snow dog",Better with Supervision,With Supervision,Seasonal,Weekly,Responds Well,"27-30 inches (male), 26-29 inches (female)",80-130 pounds,10-12 years,Barks When Necessary,medium energy,large size
Bloodhound,Hound Group,"Sweet, easygoing, friendly to all; intense when working","Somewhat Active; a mush around the house, but relentless and stubborn on the trail",Better with Supervision,With Supervision,Frequent,Occasional,Responds Well,"25-27 inches (male), 23-25 inches (female)","90-110 pounds (male), 80-100 pounds (female)",7-9 years,Barks When Necessary,medium energy,large size
Bluetick Coonhound,Hound Group,"A smart and devoted charmer at home; a fearless, tenacious pursuer on the trail","Somewhat Active; Blueticks might enjoy napping, but off-the-charts prey drive must be channeled",Better with Supervision,Yes,Seasonal,Occasional,Responds Well,"22-27 inches (male), 21-25 inches (female)","55-80 pounds (male), 45-65 pounds (female)",11-12 years,Likes To Be Vocal,high energy,medium size
Border Collie,Herding Group,Remarkably smart workaholics; not averse to a good cuddle.,"The uncanny intelligence, athleticism, and trainability of Border Collies have a perfect outlet in agility work.",Better with Older Children,Yes,Seasonal,Weekly,Eager To Please,"19-22 inches (male), 18-21 inches (female)","30-45 pounds (male), 27-42 pounds (female)",10-17 years,Barks When Necessary,high energy,medium size
Border Terrier,Terrier Group,"Plucky, happy, affectionate","Very Active; Quick and agile, Borders need exercise and time to explore",Yes,With Supervision,Seasonal,Occasional,Responds Well,12-15 inches,"13-15.5 pounds (male), 11.5-14 pounds (female)",12-15 years,Barks When Necessary,medium energy,small size
Borzoi,Hound Group,"Loyal, affectionate, regally dignified; a charming but independent-minded canine nobleman","Somewhat Active; This awesomely fast sprinter needs running room; at home, Borzoi are quiet and catlike",Better with Older Children,With Supervision,Seasonal,Occasional,Independent,"28 inches & up (male), 26 inches & up (female)","75-105 pounds (male), 60-85 pounds (female)",9-14 years,Quiet,medium energy,large size
Boston Terrier,Non Sporting Group,"Friendly, bright, amusing, and adaptable.",Their many charms have made Boston Terriers a true American favorite for more than a hundred years.,Yes,With Supervision,Infrequent,Occasional,Eager To Please,15-17 inches,10-25 pounds,13-15 years,Quiet,medium energy,small size
Bouvier des Flandres,Herding Group,"Strong-willed, even-tempered, courageous; affectionate with family, intimidating to intruders","Somewhat Active; Big, smart dogs, Bouviers like long walks and a job to do",Better with Older Children,With Supervision,Seasonal,Weekly,Responds Well,"24.5-27.5 inches (male), 23.5-26.5 inches (female)",70-110 pounds,10-12 years,Barks When Necessary,high energy,large size
Boxer,Working Group,"Fun-loving, bright, active and loyal","Very Active; Boxers are strong, quick, busy dogs who need plenty of exercise; they enjoy challenges, both physical and mental",Yes,With Supervision,Seasonal,Occasional,Responds Well,"23-25 inches (male), 21.5-23.5 inches (female)","65-80 pounds (male), females are about 15 pounds less than male",10-12 years,Barks When Necessary,high energy,medium size
Briard,Herding Group,A whole lot of dog,"Somewhat Active; Vigorous exercise and, ideally, a job to do are what they live for",Better with Supervision,With Supervision,Infrequent,Weekly,Independent,"23-27 inches (male), 22-25.5 inches (female)",55-100 pounds,12 years,Barks When Necessary,medium energy,medium size
Brittany,Sporting Group,"Bright, upbeat, fun-loving at home; a tireless, enthusiastic worker afield","Very Active; Energetic and alert, Brittanys need plenty of exercise—preferably along their favorite human",Better with Supervision,With Supervision,Seasonal,Weekly,Eager To Please,17.5-20.5 inches,30-40 pounds,12-14 years,Barks When Necessary,high energy,medium size
Broholmer,Not found!,"Bright, upbeat, fun-loving at home; a tireless, enthusiastic worker afield","Very Active; Energetic and alert, Brittanys need plenty of exercise—preferably along their favorite human",Better with Supervision,With Supervision,Seasonal,Weekly,Eager To Please,17.5-20.5 inches,30-40 pounds,12-14 years,Barks When Necessary,medium energy,large size
Brussels Griffon,Toy Group,"Alert, curious, and loyal","Somewhat Active; Griffs are spunky and love to play and to share long, daily walks with their owners",Better with Supervision,With Supervision,Seasonal,Weekly,Responds Well,7-10 inches,8-10 pounds,12-15 years,Barks When Necessary,medium energy,small size
Bull Terrier,Terrier Group,"Playful and charming; sometimes mischievous, always loyal",Very Active; Lots of exercise is needed to prevent boredom and the problem behaviors that come with it,Better with Supervision,Not Recommended,Seasonal,Occasional,Responds Well,21-22 inches,50-70 pounds,12-13 years,Barks When Necessary,high energy,medium size
Bulldog,Non Sporting Group,"Calm, courageous, and friendly; dignified but amusing.","Not Very Active; Bulldogs won't beg to be exercised, but they require regular walks and the occasional romp.",Yes,Yes,Seasonal,Weekly,Responds Well,14-15 inches,"50 pounds (male), 40 pounds (female)",8-10 years,Quiet,medium energy,medium size
Bullmastiff,Working Group,"Calm, courageous, and friendly; dignified but amusing.","Not Very Active; Bulldogs won't beg to be exercised, but they require regular walks and the occasional romp.",Yes,Yes,Seasonal,Weekly,Responds Well,14-15 inches,"50 pounds (male), 40 pounds (female)",8-10 years,Quiet,medium energy,large size
Cairn Terrier,Terrier Group,"Cheerful, alert, busy and independent-minded","Very Active; Cairns are active, curious dogs who appreciate lots of long walks and places to explore",Better with Supervision,With Supervision,Seasonal,Occasional,Responds Well,"10 inches (male), 9.5 inches (female)","14 pounds (male), 13 pounds (female)",13-15 years,Barks When Necessary,medium energy,small size
Cane Corso,Working Group,"Smart, trainable, and noble of bearing; assertive and confident, Corsi are peerless protectors.","Corsi are smart, trainable, eager to please, versatile, and docile and intensely loyal with their humans.",Better with Supervision,With Supervision,Seasonal,Occasional,Responds Well,"25-27.5 inches (male), 23.5-26 inches (female)",Proportionate to height,9-12 years,Barks When Necessary,medium energy,large size
Cardigan Welsh Corgi,Herding Group,"Loyal, affectionate, and smart; even-tempered, never shy","Very Active; Athletic, rugged herders with a love for the outdoors, Cardigans thrive on mental and physical activity",Better with Supervision,With Supervision,Seasonal,Occasional,Responds Well,10.5-12.5 inches,"30-38 pounds (male), 25-34 pounds (female)",12-15 years,Barks When Necessary,medium energy,medium size
Carolina Dog,Hound Group,"Loyal, affectionate, and smart; even-tempered, never shy","Very Active; Athletic, rugged herders with a love for the outdoors, Cardigans thrive on mental and physical activity",Better with Supervision,With Supervision,Seasonal,Occasional,Responds Well,10.5-12.5 inches,"30-38 pounds (male), 25-34 pounds (female)",12-15 years,Barks When Necessary,medium energy,medium size
Catahoula Leopard Dog,Herding Group,"Loyal, affectionate, and smart; even-tempered, never shy","Very Active; Athletic, rugged herders with a love for the outdoors, Cardigans thrive on mental and physical activity",Better with Supervision,With Supervision,Seasonal,Occasional,Responds Well,10.5-12.5 inches,"30-38 pounds (male), 25-34 pounds (female)",12-15 years,Barks When Necessary,high energy,medium size
Caucasian Shepherd Dog,Not found!,"Loyal, affectionate, and smart; even-tempered, never shy","Very Active; Athletic, rugged herders with a love for the outdoors, Cardigans thrive on mental and physical activity",Better with Supervision,With Supervision,Seasonal,Occasional,Responds Well,10.5-12.5 inches,"30-38 pounds (male), 25-34 pounds (female)",12-15 years,Barks When Necessary,medium energy,large size
Cavalier King Charles Spaniel,Toy Group,"Affectionate, graceful, and gentle.","Somewhat Active; Cavies do not require an exhaustive workout, they're happy with a good walk every day.",Yes,Yes,Seasonal,Occasional,Eager To Please,12-13 inches,13-18 pounds,12-15 years,Barks When Necessary,medium energy,small size
Cesky Terrier,Terrier Group,"Feisty and tenacious at work, but a bit more laid back and trainable than the usual terrier","Somewhat Active; Playful, curious dogs who enjoy a good old-fashioned romp",Yes,With Supervision,Seasonal,Occasional,Responds Well,10-13 inches,14-24 pounds,12-15 years,Barks When Necessary,medium energy,small size
Chesapeake Bay Retriever,Sporting Group,"Bright, sensitive, perceptive; affectionate and family-oriented","Somewhat Active; Mellow around the house, rugged and indefatigable at work; Chessies love outdoor exercise, especially swimming",Better with Supervision,With Supervision,Seasonal,Weekly,Responds Well,"23-26 inches (male), 21-24 inches (female)","65-80 pounds (male), 55-70 pounds (female)",10-13 years,Barks When Necessary,high energy,large size
Chihuahua,Toy Group,"Graceful, charming, and sassy.","Though Chihuahuas like to run and play, they are mostly an indoor pet, and do well in apartments.",Better with Older Children,With Supervision,Seasonal,Occasional,Independent,6-9 inches,3-6 pounds,12-20 years,Barks When Necessary,medium energy,small size
Chinese Crested,Toy Group,"Lively, alert, and affectionate.","Somewhat Active; Slim and graceful, Cresteds enjoy brisk walks; their favorite indoor exercise is following their humans from room to room.",Better with Supervision,With Supervision,"Infrequent, Hypoallergenic",Weekly,Responds Well,11-13 inches,8-12 pounds,13-18 years,Barks When Necessary,medium energy,small size
Chinese Shar-Pei,Non Sporting Group,"Steadfastly devoted to loved ones, but standoffish and lordly toward strangers",Somewhat Active; Not a busy dog; a good walk or two or day will suffice,Better with Older Children,Not Recommended,Seasonal,Occasional,Independent,18-20 inches,45-60 pounds,8-12 years,Barks When Necessary,medium energy,medium size
Chinook,Working Group,"Patient, smart, willing to please; a devoted family dog","Somewhat Active; Not particularly busy dogs, but they need consistent exercise to stay in proper hard condition",Yes,Yes,Seasonal,Weekly,Eager To Please,"24-26 inches (male), 22-24 inches (female)","55-90 pounds (male), 50-65 pounds (female)",12-15 years,Barks When Necessary,medium energy,large size
Chow Chow,Non Sporting Group,"Serious-minded, dignified, bright, and aloof","Not Very Active; Not particularly busy dogs, a couple of good walks a day will do",Better with Older Children,Not Recommended,Seasonal,Weekly,Independent,17-20 inches,45-70 pounds,8-12 years,Quiet,medium energy,medium size
Cirneco dell’Etna,Hound Group,"Serious-minded, dignified, bright, and aloof","Not Very Active; Not particularly busy dogs, a couple of good walks a day will do",Better with Older Children,Not Recommended,Seasonal,Weekly,Independent,17-20 inches,45-70 pounds,8-12 years,Quiet,medium energy,medium size
Clumber Spaniel,Sporting Group,"Mellow, gentlemanly, amiable; dignified but always amusing","Somewhat Active; Clumbers enjoy long walks and sniffing around; swimming, fetching, and carrying are favorite pastimes",Better with Supervision,With Supervision,Seasonal,Occasional,Responds Well,"18-20 inches (male), 17-19 inches (female)","70-85 pounds (male), 55-70 pounds (female)",10-12 years,Quiet,medium energy,large size
Cocker Spaniel,Sporting Group,"Happy, smart, gentle","Very Active; Energetic sporting dogs, Cockers love their playtime and brisk walks",Yes,Yes,Seasonal,Weekly,Eager To Please,"14.5-15.5 inches (male), 13.5-14.5 inches (female)","25-30 pounds (male), 20-25 pounds (female)",10-14 years,Barks When Necessary,medium energy,medium size
Coton de Tulear,Non Sporting Group,"Bright, happy-go-lucky, endlessly charming; born to love and to be loved","Somewhat Active; Favorite sports include clowning, cavorting, and following an adored human around the house",Yes,Yes,"Seasonal, Hypoallergenic",Weekly,Responds Well,"10-11 inches (male), 9-10 inches (female)","9-15 pounds (male), 8-13 pounds (female)",15-19 years,Barks When Necessary,medium energy,small size
Curly-Coated Retriever,Sporting Group,"Confident, proud, wickedly smart; a thinking person’s retriever","Very Active; They live for outdoor exercise, like swimming; bored, underemployed Curlies are a handful",Yes,With Supervision,Seasonal,Occasional,Responds Well,"25-27 inches (male), 23-25 inches (female)",60-95 pounds,10-12 years,Barks When Necessary,medium energy,medium size
Czechoslovakian Vlcak,Not found!,"Confident, proud, wickedly smart; a thinking person’s retriever","Very Active; They live for outdoor exercise, like swimming; bored, underemployed Curlies are a handful",Yes,With Supervision,Seasonal,Occasional,Responds Well,"25-27 inches (male), 23-25 inches (female)",60-95 pounds,10-12 years,Barks When Necessary,medium energy,small size
